{
  "triage_completed": "2025-01-01",
  "triage_context": {
    "mode": "synthetic",
    "environment": "synthetic test environment",
    "threat_model": "synthetic test model",
    "scoring": "synthetic test scoring",
    "noise_tolerance": "synthetic",
    "votes_per_finding": 1,
    "repo": "example.invalid/synthetic/repository",
    "harness_version": "0.0.0",
    "reemitted": "2025-01-02",
    "reemit_method": "synthetic fixture generation"
  },
  "summary": {
    "input_count": 1,
    "true_positives": 0,
    "hardening": 0,
    "false_positives": 1,
    "undetermined": 0,
    "duplicates": 0,
    "needs_manual_test": 0,
    "by_severity": {
      "critical": 0,
      "high": 0,
      "medium": 0,
      "low": 0,
      "informational": 0
    }
  },
  "findings": [
    {
      "id": "f001",
      "source": "synthetic-scanner",
      "title": "Synthetic finding for exact-byte storage tests",
      "file": "internal/example.go",
      "line": null,
      "category": "synthetic-category",
      "claimed_severity": "low",
      "verdict": "false_positive",
      "verify_verdict": "refuted",
      "confidence": 8,
      "severity": null,
      "severity_label": null,
      "severity_alignment": null,
      "preconditions": [],
      "access_level": null,
      "threat_match": null,
      "rationale": "Synthetic rationale containing no source repository or organizational data.",
      "vote_breakdown": null,
      "refute_reasons": [
        "Synthetic condition is not reachable."
      ],
      "exclusion_rule": null,
      "first_links": [],
      "duplicate_of": null,
      "absorbed": [],
      "owner_hint": null,
      "missing_fields": [
        "description",
        "recommendation"
      ]
    }
  ]
}
